{
	"$id": "https://crystultima.org/aurora/card.schema.json",
	"$schema": "http://json-schema.org/draft-07/schema#",
	"title": "Aurora Card Schema",
	"description": "JSON schema for Aurora cards",
	"type": "object",
	"additionalProperties": false,
	"required": ["$schema", "id", "card_type", "name", "description", "links"],
	"properties": {
		"$schema": {
			"type": "string",
			"minLength": 1
		},
		"id": {
			"$ref": "#/definitions/id_ref"
		},
		"card_type": {
			"$ref": "#/definitions/non_empty"
		},
		"card_subtype": {
			"$ref": "#/definitions/non_empty"
		},
		"name": {
			"$ref": "#/definitions/non_empty"
		},
		"description": {
			"$ref": "#/definitions/non_empty"
		},
		"status": {
			"$ref": "#/definitions/non_empty"
		},
		"boundary": {
			"$ref": "#/definitions/non_empty"
		},
		"notes": {
			"$ref": "#/definitions/non_empty"
		},
		"attributes": {
			"additionalProperties": true,
			"type": "object"
		},
		"links": {
			"type": "array",
			"uniqueItems": true,
			"items": {
				"$ref": "#/definitions/link"
			}
		}
	},
	"definitions": {
		"non_empty": {
			"type": "string",
			"minLength": 1
		},
		"id_ref": {
			"type": "string",
			"pattern": "^[A-Z]{3}-\\d{3,}$"
		},
		"link": {
			"type": "object",
			"additionalProperties": false,
			"required": ["relationship", "target"],
			"properties": {
				"relationship": {
					"$ref": "#/definitions/non_empty"
				},
				"target": {
					"$ref": "#/definitions/id_ref"
				}
			}
		}
	}
}
